{
  "$schema": "../schemas/asset-benchmark-config.schema.json",
  "repetitions": 1,
  "region": "eu-central-1",
  "concurrency": 1,
  "assetProfiles": ["large-few"],
  "implementations": ["shin", "aws"],
  "lambdaConfigs": [{ "memoryMb": 2048, "parallel": 128 }],
  "phases": [{ "name": "cold-create", "assetState": "baseline" }]
}
