{
  "$schema": "../schemas/asset-benchmark-config.schema.json",
  "repetitions": 1,
  "region": "eu-central-1",
  "concurrency": 1,
  "assetProfiles": ["mixed"],
  "implementations": ["shin"],
  "lambdaConfigs": [
    {
      "memoryMb": 1024,
      "parallel": 128
    },
    {
      "memoryMb": 2048,
      "parallel": 128
    },
    {
      "memoryMb": 3072,
      "parallel": 128
    }
  ],
  "phases": [
    {
      "name": "cold-create",
      "assetState": "baseline"
    },
    {
      "name": "unchanged-update",
      "assetState": "baseline",
      "deleteCurrentObjectsOnDelete": false
    },
    {
      "name": "changed-update",
      "assetState": "changed"
    },
    {
      "name": "pruned-update",
      "assetState": "pruned"
    }
  ]
}
