{
  "$schema": "../schemas/asset-benchmark-config.schema.json",
  "repetitions": 5,
  "region": "eu-central-1",
  "concurrency": 1,
  "assetProfiles": ["copy-archives"],
  "implementations": ["shin", "aws"],
  "lambdaConfigs": [
    {
      "memoryMb": 2048,
      "parallel": 64
    }
  ],
  "phases": [
    {
      "name": "cold-create",
      "assetState": "baseline"
    },
    {
      "name": "unchanged-update",
      "assetState": "baseline",
      "deleteCurrentObjectsOnDelete": false
    },
    {
      "name": "changed-update",
      "assetState": "changed"
    }
  ]
}
